{
  "ContractID": "urn:vcp-research:native-layout-migration:2026-10-25:v0",
  "Policies": {
    "registration": "7b0a202022526f6c65223a2022726567697374726174696f6e222c0a202022506f6c6963794944223a202275726e3a7663702d72657365617263683a726567697374726174696f6e3a6c61796f75742d7630222c0a202022506f6c69637956657273696f6e223a202230222c0a202022436f6e74726163744944223a202275726e3a7663702d72657365617263683a6e61746976652d6c61796f75742d6d6967726174696f6e3a323032362d31302d32353a7630222c0a202022417574686f72697479223a20225055424c49432054455354204b455953204f4e4c59220a7d0a",
    "numeric": "7b0a202022526f6c65223a20226e756d65726963222c0a202022506f6c6963794944223a202275726e3a7663702d72657365617263683a6e756d657269633a6c61796f75742d7630222c0a202022506f6c69637956657273696f6e223a202230222c0a202022436f6e74726163744944223a202275726e3a7663702d72657365617263683a6e61746976652d6c61796f75742d6d6967726174696f6e3a323032362d31302d32353a7630222c0a20202254696d654261736973223a2022756e69785f6e6f5f6c656170222c0a2020224669656c6473223a207b0a20202020224865616465722e54696d657374616d70496e74223a20226e73222c0a20202020224865616465722e53657175656e63654e756d223a20226f7264696e616c222c0a20202020225061796c6f61642e5643502d414e43484f522e4661696c6f76657244657461696c732e54726967676572436f6e646974696f6e2e546f74616c446f776e74696d65536563223a202273222c0a20202020225061796c6f61642e5643502d585245462e5368617265644576656e744b65792e546f6c6572616e63654d73223a20226d73222c0a20202020225061796c6f61642e5643502d474f562e436f6e666964656e636553636f7265223a2022726174696f222c0a20202020225061796c6f61642e5643502d474f562e506572666f726d616e63654d657461646174612e4c6174656e6379496d70616374223a20227573220a20207d2c0a202022446563696d616c456d697373696f6e223a2022707265736572766520616363657074656420736f75726365206c6578656d65222c0a202022526f756e64696e67223a2022666f7262696464656e220a7d0a"
  },
  "SourceArtifacts": [
    {
      "EntryID": "source-0",
      "OriginalHex": "7b0a202022466f726d6174223a202275726e3a7663702d72657365617263683a7261772d736f757263653a323032362d31302d32353a7630222c0a2020224576656e744944223a202275726e3a7663702d72657365617263683a736f757263652d6576656e743a30222c0a2020224163746f724944223a202275726e3a7663702d72657365617263683a736f757263652d6163746f72222c0a202022436861696e4944223a202275726e3a7663702d72657365617263683a736f757263652d636861696e222c0a20202253657175656e63654e756d223a20302c0a20202254696d657374616d70496e74223a20313739323838363430303030303030303030302c0a20202254696d657374616d7049534f223a2022323032362d31302d32355430303a30303a30302e3030303030303030305a222c0a20202254696d654261736973223a2022756e69785f6e6f5f6c656170222c0a202022556e697473223a207b0a202020202254696d657374616d70496e74223a20226e73222c0a20202020224475726174696f6e4d73223a20226d73222c0a2020202022546f6c6572616e63654d73223a20226d73222c0a2020202022436f6e666964656e6365223a2022726174696f222c0a20202020224c6174656e63795573223a20227573220a20207d2c0a2020224475726174696f6e4d73223a202231303030222c0a202022546f6c6572616e63654d73223a20223130222c0a202022436f6e666964656e6365223a202230312e3030222c0a2020224c6174656e63795573223a2022302e303031220a7d0a",
      "RetainedHex": "7b0a202022466f726d6174223a202275726e3a7663702d72657365617263683a7261772d736f757263653a323032362d31302d32353a7630222c0a2020224576656e744944223a202275726e3a7663702d72657365617263683a736f757263652d6576656e743a30222c0a2020224163746f724944223a202275726e3a7663702d72657365617263683a736f757263652d6163746f72222c0a202022436861696e4944223a202275726e3a7663702d72657365617263683a736f757263652d636861696e222c0a20202253657175656e63654e756d223a20302c0a20202254696d657374616d70496e74223a20313739323838363430303030303030303030302c0a20202254696d657374616d7049534f223a2022323032362d31302d32355430303a30303a30302e3030303030303030305a222c0a20202254696d654261736973223a2022756e69785f6e6f5f6c656170222c0a202022556e697473223a207b0a202020202254696d657374616d70496e74223a20226e73222c0a20202020224475726174696f6e4d73223a20226d73222c0a2020202022546f6c6572616e63654d73223a20226d73222c0a2020202022436f6e666964656e6365223a2022726174696f222c0a20202020224c6174656e63795573223a20227573220a20207d2c0a2020224475726174696f6e4d73223a202231303030222c0a202022546f6c6572616e63654d73223a20223130222c0a202022436f6e666964656e6365223a202230312e3030222c0a2020224c6174656e63795573223a2022302e303031220a7d0a",
      "Signature": "Ntdnms0e13LS5cPMj8bh2OV592IHChE5GA7XiiSc9nzECxo0CZmqRWvnpfqEu95qsel+i4oFfxynRFWMdFG4BA==",
      "RetainedSignature": "Ntdnms0e13LS5cPMj8bh2OV592IHChE5GA7XiiSc9nzECxo0CZmqRWvnpfqEu95qsel+i4oFfxynRFWMdFG4BA=="
    },
    {
      "EntryID": "source-1",
      "OriginalHex": "7b0a202022466f726d6174223a202275726e3a7663702d72657365617263683a7261772d736f757263653a323032362d31302d32353a7630222c0a2020224576656e744944223a202275726e3a7663702d72657365617263683a736f757263652d6576656e743a31222c0a2020224163746f724944223a202275726e3a7663702d72657365617263683a736f757263652d6163746f72222c0a202022436861696e4944223a202275726e3a7663702d72657365617263683a736f757263652d636861696e222c0a20202253657175656e63654e756d223a20312c0a20202254696d657374616d70496e74223a20313739323838363430303030303030303030312c0a20202254696d657374616d7049534f223a2022323032362d31302d32355430303a30303a30302e3030303030303030315a222c0a20202254696d654261736973223a2022756e69785f6e6f5f6c656170222c0a202022556e697473223a207b0a202020202254696d657374616d70496e74223a20226e73222c0a20202020224475726174696f6e4d73223a20226d73222c0a2020202022546f6c6572616e63654d73223a20226d73222c0a2020202022436f6e666964656e6365223a2022726174696f222c0a20202020224c6174656e63795573223a20227573220a20207d2c0a2020224475726174696f6e4d73223a202231303030222c0a202022546f6c6572616e63654d73223a20223130222c0a202022436f6e666964656e6365223a20222d30222c0a2020224c6174656e63795573223a2022302e303031220a7d0a",
      "RetainedHex": "7b0a202022466f726d6174223a202275726e3a7663702d72657365617263683a7261772d736f757263653a323032362d31302d32353a7630222c0a2020224576656e744944223a202275726e3a7663702d72657365617263683a736f757263652d6576656e743a31222c0a2020224163746f724944223a202275726e3a7663702d72657365617263683a736f757263652d6163746f72222c0a202022436861696e4944223a202275726e3a7663702d72657365617263683a736f757263652d636861696e222c0a20202253657175656e63654e756d223a20312c0a20202254696d657374616d70496e74223a20313739323838363430303030303030303030312c0a20202254696d657374616d7049534f223a2022323032362d31302d32355430303a30303a30302e3030303030303030315a222c0a20202254696d654261736973223a2022756e69785f6e6f5f6c656170222c0a202022556e697473223a207b0a202020202254696d657374616d70496e74223a20226e73222c0a20202020224475726174696f6e4d73223a20226d73222c0a2020202022546f6c6572616e63654d73223a20226d73222c0a2020202022436f6e666964656e6365223a2022726174696f222c0a20202020224c6174656e63795573223a20227573220a20207d2c0a2020224475726174696f6e4d73223a202231303030222c0a202022546f6c6572616e63654d73223a20223130222c0a202022436f6e666964656e6365223a20222d30222c0a2020224c6174656e63795573223a2022302e303031220a7d0a",
      "Signature": "edO1JTIPMCgUJLU0Z3X0AXCmV8r6PPNTo5TaYIZwbdmuauPPPNQ++QrNLGfkgkUY1r2MSSdrVNgG6IchIa1sCw==",
      "RetainedSignature": "edO1JTIPMCgUJLU0Z3X0AXCmV8r6PPNTo5TaYIZwbdmuauPPPNQ++QrNLGfkgkUY1r2MSSdrVNgG6IchIa1sCw=="
    },
    {
      "EntryID": "source-2",
      "OriginalHex": "7b0a202022466f726d6174223a202275726e3a7663702d72657365617263683a7261772d736f757263653a323032362d31302d32353a7630222c0a2020224576656e744944223a202275726e3a7663702d72657365617263683a736f757263652d6576656e743a32222c0a2020224163746f724944223a202275726e3a7663702d72657365617263683a736f757263652d6163746f72222c0a202022436861696e4944223a202275726e3a7663702d72657365617263683a736f757263652d636861696e222c0a20202253657175656e63654e756d223a20322c0a20202254696d657374616d70496e74223a20313739323838363430303030303030303030322c0a20202254696d657374616d7049534f223a2022323032362d31302d32355430303a30303a30302e3030303030303030325a222c0a20202254696d654261736973223a2022756e69785f6e6f5f6c656170222c0a202022556e697473223a207b0a202020202254696d657374616d70496e74223a20226e73222c0a20202020224475726174696f6e4d73223a20226d73222c0a2020202022546f6c6572616e63654d73223a20226d73222c0a2020202022436f6e666964656e6365223a2022726174696f222c0a20202020224c6174656e63795573223a20227573220a20207d2c0a2020224475726174696f6e4d73223a202231303030222c0a202022546f6c6572616e63654d73223a20223130222c0a202022436f6e666964656e6365223a2022302e3735222c0a2020224c6174656e63795573223a2022302e303031220a7d0a",
      "RetainedHex": "7b0a202022466f726d6174223a202275726e3a7663702d72657365617263683a7261772d736f757263653a323032362d31302d32353a7630222c0a2020224576656e744944223a202275726e3a7663702d72657365617263683a736f757263652d6576656e743a32222c0a2020224163746f724944223a202275726e3a7663702d72657365617263683a736f757263652d6163746f72222c0a202022436861696e4944223a202275726e3a7663702d72657365617263683a736f757263652d636861696e222c0a20202253657175656e63654e756d223a20322c0a20202254696d657374616d70496e74223a20313739323838363430303030303030303030322c0a20202254696d657374616d7049534f223a2022323032362d31302d32355430303a30303a30302e3030303030303030325a222c0a20202254696d654261736973223a2022756e69785f6e6f5f6c656170222c0a202022556e697473223a207b0a202020202254696d657374616d70496e74223a20226e73222c0a20202020224475726174696f6e4d73223a20226d73222c0a2020202022546f6c6572616e63654d73223a20226d73222c0a2020202022436f6e666964656e6365223a2022726174696f222c0a20202020224c6174656e63795573223a20227573220a20207d2c0a2020224475726174696f6e4d73223a202231303030222c0a202022546f6c6572616e63654d73223a20223130222c0a202022436f6e666964656e6365223a2022302e3735222c0a2020224c6174656e63795573223a2022302e303031220a7d0a",
      "Signature": "D+AmqAvrwNUXep5fzqbrUpSAK0cFfvmCZJXP0kEvtHHYO03SIf9ci7oFxBtnzlvg9chXXIChrY9toZmynOXjBA==",
      "RetainedSignature": "D+AmqAvrwNUXep5fzqbrUpSAK0cFfvmCZJXP0kEvtHHYO03SIf9ci7oFxBtnzlvg9chXXIChrY9toZmynOXjBA=="
    }
  ],
  "PreservedEvidence": [
    {
      "ArtifactID": "old-proof",
      "OriginalHex": "53594e544845544943204f524947494e414c20524f4f542f50524f4f462042595445530d0a30306666",